{
  "corpus": "adjudicated",
  "schema_version": "1.0",
  "note": "External-truth corpus. A case only enters the accuracy figures if its adjudication is admissible under the filter in docs/adjudication.md: a binary truth must be established by independent sources that actually assert it, and disagreement is recorded as contested, not resolved by fiat. The coverage table is part of the result.",
  "cases": [
    {
      "id": "scattered-spider-vs-unc3944",
      "split": "held-out",
      "question": "Are Scattered Spider and UNC3944 the same actor?",
      "subjects": [
        {"vendor": "CISA", "name": "Scattered Spider"},
        {"vendor": "Google/Mandiant", "name": "UNC3944"}
      ],
      "judgement": {"confidence": "high", "probability": "very_likely"},
      "evidence": [
        {"id": "E1", "statement": "Consistent operator fingerprint (distinctive self-identification, shared handles)", "source": "public reporting", "type": "operator", "consistency": {"same_actor": "C", "distinct_but_overlapping": "I", "brokered_shared_access": "C"}},
        {"id": "E2", "statement": "Shared infrastructure and tooling", "source": "public reporting", "type": "infrastructure", "consistency": {"same_actor": "C", "distinct_but_overlapping": "C", "brokered_shared_access": "C"}}
      ],
      "adjudication": {
        "truth": "same_actor",
        "standard": "government-statement",
        "decided_at": "2026-10-09",
        "adjudicators": ["Martín Eliseo"],
        "sources": [
          {"publisher": "CISA", "url": "https://www.cisa.gov/news-events/cybersecurity-advisories/aa23-320a", "category": "government", "kind": "asserts-same"},
          {"publisher": "Google Threat Intelligence", "url": "https://cloud.google.com/blog/topics/threat-intelligence/unc3944-proactive-hardening-recommendations", "category": "vendor", "kind": "asserts-same"},
          {"publisher": "Microsoft", "url": "https://learn.microsoft.com/en-us/microsoft-365/security/intelligence/microsoft-threat-actor-naming", "category": "vendor", "kind": "asserts-same", "derived_from": []},
          {"publisher": "MITRE ATT&CK", "url": "https://attack.mitre.org/groups/G1015/", "category": "community", "kind": "overlap"}
        ],
        "note": "CISA names UNC3944 and Octo Tempest as aliases; MITRE records them as Associated Groups, which is weaker than identity, so MITRE is recorded as overlap, not support."
      }
    },
    {
      "id": "apt28-vs-apt29",
      "split": "held-out",
      "question": "Are APT28 and APT29 the same actor?",
      "subjects": [
        {"vendor": "MITRE ATT&CK", "name": "APT28"},
        {"vendor": "MITRE ATT&CK", "name": "APT29"}
      ],
      "judgement": {"confidence": "high", "probability": "very_unlikely"},
      "evidence": [
        {"id": "E1", "statement": "Separate, unrelated codebases", "source": "public reporting", "type": "code", "consistency": {"same_actor": "I", "distinct_but_overlapping": "C"}},
        {"id": "E2", "statement": "Separate dedicated infrastructure", "source": "public reporting", "type": "infrastructure", "consistency": {"same_actor": "I", "distinct_but_overlapping": "C"}}
      ],
      "adjudication": {
        "truth": "distinct",
        "standard": "independent-corroboration",
        "decided_at": "2026-10-09",
        "adjudicators": ["Martín Eliseo"],
        "sources": [
          {"publisher": "MITRE ATT&CK", "url": "https://attack.mitre.org/groups/G0007/", "category": "community", "kind": "asserts-distinct"},
          {"publisher": "Microsoft", "url": "https://learn.microsoft.com/en-us/microsoft-365/security/intelligence/microsoft-threat-actor-naming", "category": "vendor", "kind": "asserts-distinct"}
        ],
        "note": "ATT&CK tracks APT28 (G0007) and APT29 (G0016) as separate groups with no cross-listing; Microsoft tracks Forest Blizzard and Midnight Blizzard separately."
      }
    },
    {
      "id": "voltzite-vs-volt-typhoon",
      "question": "Is VOLTZITE the same actor as Volt Typhoon?",
      "subjects": [
        {"vendor": "Dragos", "name": "VOLTZITE"},
        {"vendor": "Microsoft", "name": "Volt Typhoon"}
      ],
      "judgement": {"confidence": "moderate", "probability": "unlikely"},
      "evidence": [
        {"id": "E1", "statement": "Dragos describes 'extensive technical overlaps' rather than identity", "source": "Dragos 2026", "type": "linguistic", "consistency": {"same_actor": "I", "distinct_but_overlapping": "C", "brokered_shared_access": "C"}},
        {"id": "E2", "statement": "CISA lists Voltzite among the aliases", "source": "CISA AA24-038A", "type": "structural", "consistency": {"same_actor": "C", "distinct_but_overlapping": "0", "brokered_shared_access": "0"}},
        {"id": "E3", "statement": "MITRE records the names as Associated Groups, weaker than 'same actor'", "source": "MITRE ATT&CK", "type": "structural", "consistency": {"same_actor": "I", "distinct_but_overlapping": "C", "brokered_shared_access": "0"}},
        {"id": "E4", "statement": "Same targeting and tradecraft (non-diagnostic)", "source": "advisories", "type": "tactics", "consistency": {"same_actor": "C", "distinct_but_overlapping": "C", "brokered_shared_access": "C"}}
      ],
      "adjudication": {
        "truth": "contested",
        "decided_at": "2026-10-09",
        "adjudicators": ["Martín Eliseo"],
        "disagreements": [
          "CISA lists Voltzite as an alias (asserts same); Dragos and MITRE stop at 'overlap' / 'associated groups'."
        ],
        "sources": [
          {"publisher": "CISA", "url": "https://www.cisa.gov/news-events/cybersecurity-advisories/aa24-038a", "category": "government", "kind": "asserts-same"},
          {"publisher": "Dragos", "url": "https://www.dragos.com/resources/press-release/dragos-2026-year-in-review-new-ot-threats-ransomware", "category": "vendor", "kind": "overlap"},
          {"publisher": "MITRE ATT&CK", "url": "https://attack.mitre.org/groups/G1017/", "category": "community", "kind": "overlap"}
        ],
        "note": "Recorded as contested: an alias list is not an identity claim, and the load-bearing OT source declines to assert identity."
      }
    },
    {
      "id": "lazarus-vs-hidden-cobra",
      "question": "Is HIDDEN COBRA the same actor as Lazarus Group?",
      "subjects": [
        {"vendor": "US DHS", "name": "HIDDEN COBRA"},
        {"vendor": "MITRE ATT&CK", "name": "Lazarus Group"}
      ],
      "judgement": {"confidence": "low", "probability": "roughly_even_chance"},
      "evidence": [
        {"id": "E1", "statement": "MITRE lists HIDDEN COBRA among the aliases of Lazarus Group", "source": "MITRE ATT&CK", "type": "structural", "consistency": {"same_actor": "C", "distinct_but_overlapping": "C", "brokered_shared_access": "0"}},
        {"id": "E2", "statement": "DHS uses HIDDEN COBRA for DPRK cyber activity broadly, not one bounded actor", "source": "public reporting", "type": "structural", "consistency": {"same_actor": "0", "distinct_but_overlapping": "C", "brokered_shared_access": "0"}}
      ],
      "adjudication": {
        "truth": "contested",
        "decided_at": "2026-10-09",
        "adjudicators": ["Martín Eliseo"],
        "disagreements": [
          "The two labels have different scope: HIDDEN COBRA is an umbrella for DPRK activity; Lazarus Group is a narrower actor."
        ],
        "sources": [
          {"publisher": "MITRE ATT&CK", "url": "https://attack.mitre.org/groups/G0032/", "category": "community", "kind": "asserts-same"},
          {"publisher": "Wikipedia (citing US DHS terminology)", "url": "https://en.wikipedia.org/wiki/Lazarus_Group", "category": "osint", "kind": "overlap", "derived_from": ["MITRE ATT&CK"]}
        ],
        "note": "Recorded as contested because the alias is scope-dependent, not because the sources are unreliable."
      }
    }
  ]
}
